{
  "schema_version": "1.0.0",
  "profile_id": "approval-profile-claude-code-2.1.265",
  "client_id": "claude-code",
  "client_version": "2.1.265",
  "config_digest": "sha256:eb556569dafad26f56ca8a074b8000cedbb9a828cb583b6eca2adb65f7e02470",
  "operator": {
    "id": "user_lead_eng",
    "kind": "human",
    "role": "decision_owner"
  },
  "attested_at": "2026-09-09T10:00:00Z"
}
